
*** Running vivado
    with args -log top.vdi -applog -m64 -product Vivado -messageDb vivado.pb -mode batch -source top.tcl -notrace



****** Vivado v2025.1 (64-bit)
  **** SW Build 6140274 on Thu May 22 00:12:29 MDT 2025
  **** IP Build 6138677 on Thu May 22 03:10:11 MDT 2025
  **** SharedData Build 6139179 on Tue May 20 17:58:58 MDT 2025
  **** Start of session at: Fri Oct 31 12:48:19 2025
    ** Copyright 1986-2022 Xilinx, Inc. All Rights Reserved.
    ** Copyright 2022-2025 Advanced Micro Devices, Inc. All Rights Reserved.

source top.tcl -notrace
create_project: Time (s): cpu = 00:00:09 ; elapsed = 00:00:06 . Memory (MB): peak = 491.008 ; gain = 210.906
Command: link_design -top top -part xc7a35ticsg324-1L
Design is defaulting to srcset: sources_1
Design is defaulting to constrset: constrs_1
INFO: [Device 21-403] Loading part xc7a35ticsg324-1L
Netlist sorting complete. Time (s): cpu = 00:00:01 ; elapsed = 00:00:00.087 . Memory (MB): peak = 701.648 ; gain = 0.000
INFO: [Netlist 29-17] Analyzing 1117 Unisim elements for replacement
INFO: [Netlist 29-28] Unisim Transformation completed in 0 CPU seconds
INFO: [Project 1-479] Netlist was created with Vivado 2025.1
INFO: [Project 1-570] Preparing netlist for logic optimization
Parsing XDC File [C:/Users/nguye/Desktop/artya7/artya7.srcs/constrs_1/new/constraint.xdc]
Finished Parsing XDC File [C:/Users/nguye/Desktop/artya7/artya7.srcs/constrs_1/new/constraint.xdc]
INFO: [Opt 31-138] Pushed 0 inverter(s) to 0 load pin(s).
Netlist sorting complete. Time (s): cpu = 00:00:00 ; elapsed = 00:00:00.006 . Memory (MB): peak = 847.535 ; gain = 0.000
INFO: [Project 1-111] Unisim Transformation Summary:
  A total of 2 instances were transformed.
  IOBUF => IOBUF (IBUF, OBUFT): 2 instances

7 Infos, 0 Warnings, 0 Critical Warnings and 0 Errors encountered.
link_design completed successfully
link_design: Time (s): cpu = 00:00:04 ; elapsed = 00:00:06 . Memory (MB): peak = 847.535 ; gain = 356.527
Command: opt_design
Attempting to get a license for feature 'Implementation' and/or device 'xc7a35ti'
INFO: [Common 17-349] Got license for feature 'Implementation' and/or device 'xc7a35ti'
Running DRC as a precondition to command opt_design

Starting DRC Task
INFO: [DRC 23-27] Running DRC with 2 threads
INFO: [Project 1-461] DRC finished with 0 Errors
INFO: [Project 1-462] Please refer to the DRC report (report_drc) for more information.

Time (s): cpu = 00:00:03 ; elapsed = 00:00:02 . Memory (MB): peak = 885.215 ; gain = 37.680

Starting Cache Timing Information Task
INFO: [Timing 38-35] Done setting XDC timing constraints.
Ending Cache Timing Information Task | Checksum: 1db0449c0

Time (s): cpu = 00:00:07 ; elapsed = 00:00:07 . Memory (MB): peak = 1425.547 ; gain = 540.332

Starting Logic Optimization Task

Phase 1 Initialization

Phase 1.1 Core Generation And Design Setup
Phase 1.1 Core Generation And Design Setup | Checksum: 1db0449c0

Time (s): cpu = 00:00:00 ; elapsed = 00:00:00.009 . Memory (MB): peak = 1856.195 ; gain = 0.000

Phase 1.2 Setup Constraints And Sort Netlist
Phase 1.2 Setup Constraints And Sort Netlist | Checksum: 1db0449c0

Time (s): cpu = 00:00:00 ; elapsed = 00:00:00.022 . Memory (MB): peak = 1856.195 ; gain = 0.000
Phase 1 Initialization | Checksum: 1db0449c0

Time (s): cpu = 00:00:00 ; elapsed = 00:00:00.023 . Memory (MB): peak = 1856.195 ; gain = 0.000

Phase 2 Timer Update And Timing Data Collection

Phase 2.1 Timer Update
Phase 2.1 Timer Update | Checksum: 1db0449c0

Time (s): cpu = 00:00:00 ; elapsed = 00:00:00.273 . Memory (MB): peak = 1856.195 ; gain = 0.000

Phase 2.2 Timing Data Collection
Phase 2.2 Timing Data Collection | Checksum: 1db0449c0

Time (s): cpu = 00:00:00 ; elapsed = 00:00:00.290 . Memory (MB): peak = 1856.195 ; gain = 0.000
Phase 2 Timer Update And Timing Data Collection | Checksum: 1db0449c0

Time (s): cpu = 00:00:00 ; elapsed = 00:00:00.291 . Memory (MB): peak = 1856.195 ; gain = 0.000

Phase 3 Retarget
INFO: [Opt 31-1851] Number of loadless carry chains removed were: 0
INFO: [Opt 31-1834] Total Chains To Be Transformed Were: 0 AND Number of Transformed insts Created are: 0
INFO: [Opt 31-138] Pushed 0 inverter(s) to 0 load pin(s).
INFO: [Opt 31-49] Retargeted 0 cell(s).
Phase 3 Retarget | Checksum: 1ac8e5640

Time (s): cpu = 00:00:00 ; elapsed = 00:00:00.465 . Memory (MB): peak = 1856.195 ; gain = 0.000
Retarget | Checksum: 1ac8e5640
INFO: [Opt 31-389] Phase Retarget created 66 cells and removed 67 cells

Phase 4 Constant propagation
INFO: [Opt 31-138] Pushed 0 inverter(s) to 0 load pin(s).
Phase 4 Constant propagation | Checksum: 1effcbd71

Time (s): cpu = 00:00:00 ; elapsed = 00:00:00.580 . Memory (MB): peak = 1856.195 ; gain = 0.000
Constant propagation | Checksum: 1effcbd71
INFO: [Opt 31-389] Phase Constant propagation created 0 cells and removed 0 cells

Phase 5 Sweep
INFO: [Constraints 18-11670] Building netlist checker database with flags, 0x8
Done building netlist checker database: Time (s): cpu = 00:00:00 ; elapsed = 00:00:00.003 . Memory (MB): peak = 1856.195 ; gain = 0.000
Phase 5 Sweep | Checksum: 2509505ab

Time (s): cpu = 00:00:01 ; elapsed = 00:00:00.712 . Memory (MB): peak = 1856.195 ; gain = 0.000
Sweep | Checksum: 2509505ab
INFO: [Opt 31-389] Phase Sweep created 0 cells and removed 0 cells

Phase 6 BUFG optimization
Phase 6 BUFG optimization | Checksum: 2509505ab

Time (s): cpu = 00:00:01 ; elapsed = 00:00:00.783 . Memory (MB): peak = 1856.195 ; gain = 0.000
BUFG optimization | Checksum: 2509505ab
INFO: [Opt 31-662] Phase BUFG optimization created 0 cells of which 0 are BUFGs and removed 0 cells.

Phase 7 Shift Register Optimization
INFO: [Opt 31-1064] SRL Remap converted 0 SRLs to 0 registers and converted 0 registers of register chains to 0 SRLs
Phase 7 Shift Register Optimization | Checksum: 2509505ab

Time (s): cpu = 00:00:01 ; elapsed = 00:00:00.795 . Memory (MB): peak = 1856.195 ; gain = 0.000
Shift Register Optimization | Checksum: 2509505ab
INFO: [Opt 31-389] Phase Shift Register Optimization created 0 cells and removed 0 cells

Phase 8 Post Processing Netlist
Phase 8 Post Processing Netlist | Checksum: 2509505ab

Time (s): cpu = 00:00:01 ; elapsed = 00:00:00.844 . Memory (MB): peak = 1856.195 ; gain = 0.000
Post Processing Netlist | Checksum: 2509505ab
INFO: [Opt 31-389] Phase Post Processing Netlist created 0 cells and removed 0 cells

Phase 9 Finalization

Phase 9.1 Finalizing Design Cores and Updating Shapes
Phase 9.1 Finalizing Design Cores and Updating Shapes | Checksum: 1b724fb94

Time (s): cpu = 00:00:01 ; elapsed = 00:00:00.949 . Memory (MB): peak = 1856.195 ; gain = 0.000

Phase 9.2 Verifying Netlist Connectivity

Starting Connectivity Check Task

Time (s): cpu = 00:00:00 ; elapsed = 00:00:00.021 . Memory (MB): peak = 1856.195 ; gain = 0.000
Phase 9.2 Verifying Netlist Connectivity | Checksum: 1b724fb94

Time (s): cpu = 00:00:01 ; elapsed = 00:00:00.971 . Memory (MB): peak = 1856.195 ; gain = 0.000
Phase 9 Finalization | Checksum: 1b724fb94

Time (s): cpu = 00:00:01 ; elapsed = 00:00:00.973 . Memory (MB): peak = 1856.195 ; gain = 0.000
Opt_design Change Summary
=========================


-------------------------------------------------------------------------------------------------------------------------
|  Phase                        |  #Cells created  |  #Cells Removed  |  #Constrained objects preventing optimizations  |
-------------------------------------------------------------------------------------------------------------------------
|  Retarget                     |              66  |              67  |                                              0  |
|  Constant propagation         |               0  |               0  |                                              0  |
|  Sweep                        |               0  |               0  |                                              0  |
|  BUFG optimization            |               0  |               0  |                                              0  |
|  Shift Register Optimization  |               0  |               0  |                                              0  |
|  Post Processing Netlist      |               0  |               0  |                                              0  |
-------------------------------------------------------------------------------------------------------------------------


Ending Logic Optimization Task | Checksum: 1b724fb94

Time (s): cpu = 00:00:01 ; elapsed = 00:00:00.977 . Memory (MB): peak = 1856.195 ; gain = 0.000

Starting Power Optimization Task
INFO: [Pwropt 34-132] Skipping clock gating for clocks with a period < 2.00 ns.
INFO: [Pwropt 34-9] Applying IDT optimizations ...
INFO: [Pwropt 34-10] Applying ODC optimizations ...
INFO: [Timing 38-35] Done setting XDC timing constraints.
Running Vector-less Activity Propagation...

Finished Running Vector-less Activity Propagation


Starting PowerOpt Patch Enables Task
INFO: [Pwropt 34-162] WRITE_MODE attribute of 0 BRAM(s) out of a total of 9 has been updated to save power. Run report_power_opt to get a complete listing of the BRAMs updated.
INFO: [Pwropt 34-201] Structural ODC has moved 0 WE to EN ports
Number of BRAM Ports augmented: 2 newly gated: 0 Total Ports: 18
Number of Flops added for Enable Generation: 2

Ending PowerOpt Patch Enables Task | Checksum: 225be4ea2

Time (s): cpu = 00:00:00 ; elapsed = 00:00:00.049 . Memory (MB): peak = 1955.910 ; gain = 0.000
Ending Power Optimization Task | Checksum: 225be4ea2

Time (s): cpu = 00:00:08 ; elapsed = 00:00:04 . Memory (MB): peak = 1955.910 ; gain = 99.715

Starting Final Cleanup Task

Starting Logic Optimization Task
INFO: [Timing 38-35] Done setting XDC timing constraints.
Ending Logic Optimization Task | Checksum: 22877544a

Time (s): cpu = 00:00:01 ; elapsed = 00:00:00.905 . Memory (MB): peak = 1955.910 ; gain = 0.000
Ending Final Cleanup Task | Checksum: 22877544a

Time (s): cpu = 00:00:05 ; elapsed = 00:00:05 . Memory (MB): peak = 1955.910 ; gain = 0.000

Starting Netlist Obfuscation Task
Netlist sorting complete. Time (s): cpu = 00:00:00 ; elapsed = 00:00:00.005 . Memory (MB): peak = 1955.910 ; gain = 0.000
Ending Netlist Obfuscation Task | Checksum: 22877544a

Time (s): cpu = 00:00:00 ; elapsed = 00:00:00.006 . Memory (MB): peak = 1955.910 ; gain = 0.000
INFO: [Common 17-83] Releasing license: Implementation
33 Infos, 0 Warnings, 0 Critical Warnings and 0 Errors encountered.
opt_design completed successfully
opt_design: Time (s): cpu = 00:00:28 ; elapsed = 00:00:22 . Memory (MB): peak = 1955.910 ; gain = 1108.375
INFO: [Vivado 12-24828] Executing command : report_drc -file top_drc_opted.rpt -pb top_drc_opted.pb -rpx top_drc_opted.rpx
Command: report_drc -file top_drc_opted.rpt -pb top_drc_opted.pb -rpx top_drc_opted.rpx
INFO: [IP_Flow 19-234] Refreshing IP repositories
INFO: [IP_Flow 19-1704] No user IP repositories specified
INFO: [IP_Flow 19-2313] Loaded Vivado IP repository 'C:/Xilinx2025/2025.1/Vivado/data/ip'.
INFO: [DRC 23-27] Running DRC with 2 threads
INFO: [Vivado_Tcl 2-168] The results of DRC are in file C:/Users/nguye/Desktop/artya7/artya7.runs/impl_1/top_drc_opted.rpt.
report_drc completed successfully
INFO: [Timing 38-480] Writing timing data to binary archive.
Wrote PlaceDB: Time (s): cpu = 00:00:00 ; elapsed = 00:00:00.002 . Memory (MB): peak = 1955.910 ; gain = 0.000
Wrote PulsedLatchDB: Time (s): cpu = 00:00:00 ; elapsed = 00:00:00 . Memory (MB): peak = 1955.910 ; gain = 0.000
Writing XDEF routing.
Writing XDEF routing logical nets.
Write ShapeDB Complete: Time (s): cpu = 00:00:01 ; elapsed = 00:00:00.031 . Memory (MB): peak = 1955.910 ; gain = 0.000
Writing XDEF routing special nets.
Wrote RouteStorage: Time (s): cpu = 00:00:01 ; elapsed = 00:00:00.034 . Memory (MB): peak = 1955.910 ; gain = 0.000
Wrote Netlist Cache: Time (s): cpu = 00:00:00 ; elapsed = 00:00:00 . Memory (MB): peak = 1955.910 ; gain = 0.000
Wrote Device Cache: Time (s): cpu = 00:00:00 ; elapsed = 00:00:00.007 . Memory (MB): peak = 1955.910 ; gain = 0.000
Write Physdb Complete: Time (s): cpu = 00:00:01 ; elapsed = 00:00:00.047 . Memory (MB): peak = 1955.910 ; gain = 0.000
INFO: [Common 17-1381] The checkpoint 'C:/Users/nguye/Desktop/artya7/artya7.runs/impl_1/top_opt.dcp' has been generated.
Command: place_design
Attempting to get a license for feature 'Implementation' and/or device 'xc7a35ti'
INFO: [Common 17-349] Got license for feature 'Implementation' and/or device 'xc7a35ti'
INFO: [Common 17-83] Releasing license: Implementation
INFO: [DRC 23-27] Running DRC with 2 threads
INFO: [Vivado_Tcl 4-198] DRC finished with 0 Errors
INFO: [Vivado_Tcl 4-199] Please refer to the DRC report (report_drc) for more information.
Running DRC as a precondition to command place_design
INFO: [DRC 23-27] Running DRC with 2 threads
INFO: [Vivado_Tcl 4-198] DRC finished with 0 Errors, 21 Warnings
INFO: [Vivado_Tcl 4-199] Please refer to the DRC report (report_drc) for more information.
INFO: [Place 30-611] Multithreading enabled for place_design using a maximum of 2 CPUs

Starting Placer Task

Phase 1 Placer Initialization

Phase 1.1 Placer Initialization Netlist Sorting
Netlist sorting complete. Time (s): cpu = 00:00:00 ; elapsed = 00:00:00.009 . Memory (MB): peak = 1955.910 ; gain = 0.000
Phase 1.1 Placer Initialization Netlist Sorting | Checksum: 1932bdf23

Time (s): cpu = 00:00:00 ; elapsed = 00:00:00.013 . Memory (MB): peak = 1955.910 ; gain = 0.000
Netlist sorting complete. Time (s): cpu = 00:00:00 ; elapsed = 00:00:00.007 . Memory (MB): peak = 1955.910 ; gain = 0.000

Phase 1.2 IO Placement/ Clock Placement/ Build Placer Device
INFO: [Timing 38-35] Done setting XDC timing constraints.
Phase 1.2 IO Placement/ Clock Placement/ Build Placer Device | Checksum: 1b8bfb23c

Time (s): cpu = 00:00:02 ; elapsed = 00:00:01 . Memory (MB): peak = 1955.910 ; gain = 0.000

Phase 1.3 Build Placer Netlist Model
Phase 1.3 Build Placer Netlist Model | Checksum: 1fb166298

Time (s): cpu = 00:00:05 ; elapsed = 00:00:03 . Memory (MB): peak = 1955.910 ; gain = 0.000

Phase 1.4 Constrain Clocks/Macros
Phase 1.4 Constrain Clocks/Macros | Checksum: 1fb166298

Time (s): cpu = 00:00:05 ; elapsed = 00:00:03 . Memory (MB): peak = 1955.910 ; gain = 0.000
Phase 1 Placer Initialization | Checksum: 1fb166298

Time (s): cpu = 00:00:05 ; elapsed = 00:00:03 . Memory (MB): peak = 1955.910 ; gain = 0.000

Phase 2 Global Placement

Phase 2.1 Floorplanning
Phase 2.1 Floorplanning | Checksum: 1bc7e5cd7

Time (s): cpu = 00:00:07 ; elapsed = 00:00:04 . Memory (MB): peak = 1955.910 ; gain = 0.000

Phase 2.2 Update Timing before SLR Path Opt
Phase 2.2 Update Timing before SLR Path Opt | Checksum: 1cfdcb3eb

Time (s): cpu = 00:00:08 ; elapsed = 00:00:05 . Memory (MB): peak = 1955.910 ; gain = 0.000

Phase 2.3 Post-Processing in Floorplanning
Phase 2.3 Post-Processing in Floorplanning | Checksum: 1cfdcb3eb

Time (s): cpu = 00:00:08 ; elapsed = 00:00:05 . Memory (MB): peak = 1955.910 ; gain = 0.000

Phase 2.4 Global Place Phase1
Phase 2.4 Global Place Phase1 | Checksum: 1de684dac

Time (s): cpu = 00:00:19 ; elapsed = 00:00:11 . Memory (MB): peak = 1955.910 ; gain = 0.000

Phase 2.5 Global Place Phase2

Phase 2.5.1 UpdateTiming Before Physical Synthesis
Phase 2.5.1 UpdateTiming Before Physical Synthesis | Checksum: 1acf5df29

Time (s): cpu = 00:00:20 ; elapsed = 00:00:12 . Memory (MB): peak = 1955.910 ; gain = 0.000

Phase 2.5.2 Physical Synthesis In Placer
INFO: [Physopt 32-1035] Found 0 LUTNM shape to break, 438 LUT instances to create LUTNM shape
INFO: [Physopt 32-1044] Break lutnm for timing: one critical 0, two critical 0, total 0, new lutff created 0
INFO: [Physopt 32-1138] End 1 Pass. Optimized 199 nets or LUTs. Breaked 0 LUT, combined 199 existing LUTs and moved 0 existing LUT
INFO: [Physopt 32-65] No nets found for high-fanout optimization.
INFO: [Physopt 32-232] Optimized 0 net. Created 0 new instance.
INFO: [Physopt 32-775] End 1 Pass. Optimized 0 net or cell. Created 0 new cell, deleted 0 existing cell and moved 0 existing cell
INFO: [Physopt 32-670] No setup violation found.  DSP Register Optimization was not performed.
INFO: [Physopt 32-670] No setup violation found.  Shift Register to Pipeline Optimization was not performed.
INFO: [Physopt 32-670] No setup violation found.  Shift Register Optimization was not performed.
INFO: [Physopt 32-670] No setup violation found.  BRAM Register Optimization was not performed.
INFO: [Physopt 32-670] No setup violation found.  URAM Register Optimization was not performed.
INFO: [Physopt 32-949] No candidate nets found for dynamic/static region interface net replication
INFO: [Physopt 32-775] End 1 Pass. Optimized 0 net or cell. Created 0 new cell, deleted 0 existing cell and moved 0 existing cell
Netlist sorting complete. Time (s): cpu = 00:00:00 ; elapsed = 00:00:00.004 . Memory (MB): peak = 1955.910 ; gain = 0.000

Summary of Physical Synthesis Optimizations
============================================


-----------------------------------------------------------------------------------------------------------------------------------------------------------
|  Optimization                                     |  Added Cells  |  Removed Cells  |  Optimized Cells/Nets  |  Dont Touch  |  Iterations  |  Elapsed   |
-----------------------------------------------------------------------------------------------------------------------------------------------------------
|  LUT Combining                                    |            0  |            199  |                   199  |           0  |           1  |  00:00:00  |
|  Retime                                           |            0  |              0  |                     0  |           0  |           1  |  00:00:00  |
|  Very High Fanout                                 |            0  |              0  |                     0  |           0  |           1  |  00:00:00  |
|  DSP Register                                     |            0  |              0  |                     0  |           0  |           0  |  00:00:00  |
|  Shift Register to Pipeline                       |            0  |              0  |                     0  |           0  |           0  |  00:00:00  |
|  Shift Register                                   |            0  |              0  |                     0  |           0  |           0  |  00:00:00  |
|  BRAM Register                                    |            0  |              0  |                     0  |           0  |           0  |  00:00:00  |
|  URAM Register                                    |            0  |              0  |                     0  |           0  |           0  |  00:00:00  |
|  Dynamic/Static Region Interface Net Replication  |            0  |              0  |                     0  |           0  |           1  |  00:00:00  |
|  Total                                            |            0  |            199  |                   199  |           0  |           4  |  00:00:00  |
-----------------------------------------------------------------------------------------------------------------------------------------------------------


Phase 2.5.2 Physical Synthesis In Placer | Checksum: 161886da2

Time (s): cpu = 00:00:22 ; elapsed = 00:00:13 . Memory (MB): peak = 1955.910 ; gain = 0.000
Phase 2.5 Global Place Phase2 | Checksum: 1a531c008

Time (s): cpu = 00:00:22 ; elapsed = 00:00:14 . Memory (MB): peak = 1955.910 ; gain = 0.000
Phase 2 Global Placement | Checksum: 1a531c008

Time (s): cpu = 00:00:22 ; elapsed = 00:00:14 . Memory (MB): peak = 1955.910 ; gain = 0.000

Phase 3 Detail Placement

Phase 3.1 Commit Multi Column Macros
Phase 3.1 Commit Multi Column Macros | Checksum: 188a69754

Time (s): cpu = 00:00:24 ; elapsed = 00:00:15 . Memory (MB): peak = 1955.910 ; gain = 0.000

Phase 3.2 Commit Most Macros & LUTRAMs
Phase 3.2 Commit Most Macros & LUTRAMs | Checksum: 1ff6b2e14

Time (s): cpu = 00:00:26 ; elapsed = 00:00:16 . Memory (MB): peak = 1955.910 ; gain = 0.000

Phase 3.3 Area Swap Optimization
Phase 3.3 Area Swap Optimization | Checksum: 1a08f9eae

Time (s): cpu = 00:00:26 ; elapsed = 00:00:16 . Memory (MB): peak = 1955.910 ; gain = 0.000

Phase 3.4 Pipeline Register Optimization
Phase 3.4 Pipeline Register Optimization | Checksum: 184c9f4aa

Time (s): cpu = 00:00:26 ; elapsed = 00:00:16 . Memory (MB): peak = 1955.910 ; gain = 0.000

Phase 3.5 Fast Optimization
Phase 3.5 Fast Optimization | Checksum: 1f4da5071

Time (s): cpu = 00:00:29 ; elapsed = 00:00:18 . Memory (MB): peak = 1955.910 ; gain = 0.000

Phase 3.6 Small Shape Detail Placement
Phase 3.6 Small Shape Detail Placement | Checksum: 20ec09404

Time (s): cpu = 00:00:35 ; elapsed = 00:00:26 . Memory (MB): peak = 1955.910 ; gain = 0.000

Phase 3.7 Re-assign LUT pins
Phase 3.7 Re-assign LUT pins | Checksum: 1b7bdc34e

Time (s): cpu = 00:00:36 ; elapsed = 00:00:26 . Memory (MB): peak = 1955.910 ; gain = 0.000

Phase 3.8 Pipeline Register Optimization
Phase 3.8 Pipeline Register Optimization | Checksum: 19da55941

Time (s): cpu = 00:00:36 ; elapsed = 00:00:26 . Memory (MB): peak = 1955.910 ; gain = 0.000
Phase 3 Detail Placement | Checksum: 19da55941

Time (s): cpu = 00:00:36 ; elapsed = 00:00:26 . Memory (MB): peak = 1955.910 ; gain = 0.000

Phase 4 Post Placement Optimization and Clean-Up

Phase 4.1 Post Commit Optimization
INFO: [Timing 38-35] Done setting XDC timing constraints.

Phase 4.1.1 Post Placement Optimization
Post Placement Optimization Initialization | Checksum: 1a95d6a67

Phase 4.1.1.1 BUFG Insertion

Starting Physical Synthesis Task

Phase 1 Physical Synthesis Initialization
INFO: [Physopt 32-721] Multithreading enabled for phys_opt_design using a maximum of 2 CPUs
INFO: [Physopt 32-619] Estimated Timing Summary | WNS=-0.241 | TNS=-3.519 |
Phase 1 Physical Synthesis Initialization | Checksum: 108151720

Time (s): cpu = 00:00:00 ; elapsed = 00:00:00.161 . Memory (MB): peak = 1955.910 ; gain = 0.000
INFO: [Place 46-33] Processed net riscv0/register_file/rstn_reg, BUFG insertion was skipped due to placement/routing conflicts.
INFO: [Place 46-56] BUFG insertion identified 1 candidate nets. Inserted BUFG: 0, Replicated BUFG Driver: 0, Skipped due to Placement/Routing Conflicts: 1, Skipped due to Timing Degradation: 0, Skipped due to netlist editing failed: 0.
Ending Physical Synthesis Task | Checksum: 1d7670591

Time (s): cpu = 00:00:00 ; elapsed = 00:00:00.483 . Memory (MB): peak = 1955.910 ; gain = 0.000
Phase 4.1.1.1 BUFG Insertion | Checksum: 1a95d6a67

Time (s): cpu = 00:00:39 ; elapsed = 00:00:28 . Memory (MB): peak = 1955.910 ; gain = 0.000

Phase 4.1.1.2 Post Placement Timing Optimization
INFO: [Place 30-746] Post Placement Timing Summary WNS=0.510. For the most accurate timing information please run report_timing.
Phase 4.1.1.2 Post Placement Timing Optimization | Checksum: 1a8dd8a8e

Time (s): cpu = 00:00:44 ; elapsed = 00:00:33 . Memory (MB): peak = 1955.910 ; gain = 0.000

Time (s): cpu = 00:00:44 ; elapsed = 00:00:33 . Memory (MB): peak = 1955.910 ; gain = 0.000
Phase 4.1 Post Commit Optimization | Checksum: 1a8dd8a8e

Time (s): cpu = 00:00:44 ; elapsed = 00:00:33 . Memory (MB): peak = 1955.910 ; gain = 0.000

Phase 4.2 Post Placement Cleanup
Phase 4.2 Post Placement Cleanup | Checksum: 1a8dd8a8e

Time (s): cpu = 00:00:45 ; elapsed = 00:00:33 . Memory (MB): peak = 1955.910 ; gain = 0.000

Phase 4.3 Placer Reporting

Phase 4.3.1 Print Estimated Congestion
INFO: [Place 30-612] Post-Placement Estimated Congestion 
 ____________________________________________________
|           | Global Congestion | Short Congestion  |
| Direction | Region Size       | Region Size       |
|___________|___________________|___________________|
|      North|                1x1|                2x2|
|___________|___________________|___________________|
|      South|                1x1|                2x2|
|___________|___________________|___________________|
|       East|                1x1|                1x1|
|___________|___________________|___________________|
|       West|                1x1|                1x1|
|___________|___________________|___________________|

Phase 4.3.1 Print Estimated Congestion | Checksum: 1a8dd8a8e

Time (s): cpu = 00:00:45 ; elapsed = 00:00:33 . Memory (MB): peak = 1955.910 ; gain = 0.000
Phase 4.3 Placer Reporting | Checksum: 1a8dd8a8e

Time (s): cpu = 00:00:45 ; elapsed = 00:00:33 . Memory (MB): peak = 1955.910 ; gain = 0.000

Phase 4.4 Final Placement Cleanup
Netlist sorting complete. Time (s): cpu = 00:00:00 ; elapsed = 00:00:00.010 . Memory (MB): peak = 1955.910 ; gain = 0.000

Time (s): cpu = 00:00:45 ; elapsed = 00:00:33 . Memory (MB): peak = 1955.910 ; gain = 0.000
Phase 4 Post Placement Optimization and Clean-Up | Checksum: 1ccdd31b3

Time (s): cpu = 00:00:45 ; elapsed = 00:00:34 . Memory (MB): peak = 1955.910 ; gain = 0.000
Ending Placer Task | Checksum: 11180dead

Time (s): cpu = 00:00:45 ; elapsed = 00:00:34 . Memory (MB): peak = 1955.910 ; gain = 0.000
71 Infos, 0 Warnings, 0 Critical Warnings and 0 Errors encountered.
place_design completed successfully
place_design: Time (s): cpu = 00:00:49 ; elapsed = 00:00:36 . Memory (MB): peak = 1955.910 ; gain = 0.000
INFO: [Vivado 12-24838] Running report commands "report_control_sets, report_io, report_utilization" in parallel.
Running report generation with 2 threads.
INFO: [Vivado 12-24828] Executing command : report_io -file top_io_placed.rpt
report_io: Time (s): cpu = 00:00:00 ; elapsed = 00:00:00.056 . Memory (MB): peak = 1955.910 ; gain = 0.000
INFO: [Vivado 12-24828] Executing command : report_control_sets -verbose -file top_control_sets_placed.rpt
report_control_sets: Time (s): cpu = 00:00:00 ; elapsed = 00:00:00.042 . Memory (MB): peak = 1955.910 ; gain = 0.000
INFO: [Vivado 12-24828] Executing command : report_utilization -file top_utilization_placed.rpt -pb top_utilization_placed.pb
INFO: [Timing 38-480] Writing timing data to binary archive.
Write ShapeDB Complete: Time (s): cpu = 00:00:00 ; elapsed = 00:00:00.048 . Memory (MB): peak = 1955.910 ; gain = 0.000
Wrote PlaceDB: Time (s): cpu = 00:00:02 ; elapsed = 00:00:01 . Memory (MB): peak = 1955.910 ; gain = 0.000
Wrote PulsedLatchDB: Time (s): cpu = 00:00:00 ; elapsed = 00:00:00 . Memory (MB): peak = 1955.910 ; gain = 0.000
Writing XDEF routing.
Writing XDEF routing logical nets.
Writing XDEF routing special nets.
Wrote RouteStorage: Time (s): cpu = 00:00:00 ; elapsed = 00:00:00.024 . Memory (MB): peak = 1955.910 ; gain = 0.000
Wrote Netlist Cache: Time (s): cpu = 00:00:00 ; elapsed = 00:00:00.025 . Memory (MB): peak = 1955.910 ; gain = 0.000
Wrote Device Cache: Time (s): cpu = 00:00:00 ; elapsed = 00:00:00.008 . Memory (MB): peak = 1955.910 ; gain = 0.000
Write Physdb Complete: Time (s): cpu = 00:00:02 ; elapsed = 00:00:01 . Memory (MB): peak = 1955.910 ; gain = 0.000
INFO: [Common 17-1381] The checkpoint 'C:/Users/nguye/Desktop/artya7/artya7.runs/impl_1/top_placed.dcp' has been generated.
Command: phys_opt_design
Attempting to get a license for feature 'Implementation' and/or device 'xc7a35ti'
INFO: [Common 17-349] Got license for feature 'Implementation' and/or device 'xc7a35ti'

Starting Initial Update Timing Task

Time (s): cpu = 00:00:03 ; elapsed = 00:00:02 . Memory (MB): peak = 1955.910 ; gain = 0.000
INFO: [Vivado_Tcl 4-2279] Estimated Timing Summary | WNS= 0.411 | TNS= 0.000 | 
INFO: [Vivado_Tcl 4-383] Design worst setup slack (WNS) is greater than or equal to 0.000 ns. All physical synthesis setup optimizations will be skipped.
INFO: [Vivado_Tcl 4-232] No setup violation found. The netlist was not modified.
INFO: [Common 17-83] Releasing license: Implementation
82 Infos, 0 Warnings, 0 Critical Warnings and 0 Errors encountered.
phys_opt_design completed successfully
INFO: [Timing 38-480] Writing timing data to binary archive.
Write ShapeDB Complete: Time (s): cpu = 00:00:00 ; elapsed = 00:00:00.047 . Memory (MB): peak = 1963.969 ; gain = 1.918
Wrote PlaceDB: Time (s): cpu = 00:00:01 ; elapsed = 00:00:00.998 . Memory (MB): peak = 1963.969 ; gain = 1.918
Wrote PulsedLatchDB: Time (s): cpu = 00:00:00 ; elapsed = 00:00:00 . Memory (MB): peak = 1963.969 ; gain = 0.000
Writing XDEF routing.
Writing XDEF routing logical nets.
Writing XDEF routing special nets.
Wrote RouteStorage: Time (s): cpu = 00:00:00 ; elapsed = 00:00:00.022 . Memory (MB): peak = 1963.969 ; gain = 0.000
Wrote Netlist Cache: Time (s): cpu = 00:00:00 ; elapsed = 00:00:00.022 . Memory (MB): peak = 1963.969 ; gain = 0.000
Wrote Device Cache: Time (s): cpu = 00:00:00 ; elapsed = 00:00:00.007 . Memory (MB): peak = 1963.969 ; gain = 0.000
Write Physdb Complete: Time (s): cpu = 00:00:02 ; elapsed = 00:00:01 . Memory (MB): peak = 1963.969 ; gain = 1.918
INFO: [Common 17-1381] The checkpoint 'C:/Users/nguye/Desktop/artya7/artya7.runs/impl_1/top_physopt.dcp' has been generated.
Command: route_design
Attempting to get a license for feature 'Implementation' and/or device 'xc7a35ti'
INFO: [Common 17-349] Got license for feature 'Implementation' and/or device 'xc7a35ti'


Starting Routing Task
INFO: [Route 35-254] Multithreading enabled for route_design using a maximum of 2 CPUs

Phase 1 Build RT Design
Checksum: PlaceDB: 41781335 ConstDB: 0 ShapeSum: 2f876f21 RouteDB: a0815c57
Post Restoration Checksum: NetGraph: 656373d0 | NumContArr: 946f7b2e | Constraints: c2a8fa9d | Timing: c2a8fa9d
Phase 1 Build RT Design | Checksum: 27f24e438

Time (s): cpu = 00:00:27 ; elapsed = 00:00:23 . Memory (MB): peak = 2043.449 ; gain = 79.480

Phase 2 Router Initialization

Phase 2.1 Fix Topology Constraints
Phase 2.1 Fix Topology Constraints | Checksum: 27f24e438

Time (s): cpu = 00:00:27 ; elapsed = 00:00:23 . Memory (MB): peak = 2043.449 ; gain = 79.480

Phase 2.2 Pre Route Cleanup
Phase 2.2 Pre Route Cleanup | Checksum: 27f24e438

Time (s): cpu = 00:00:27 ; elapsed = 00:00:23 . Memory (MB): peak = 2043.449 ; gain = 79.480
 Number of Nodes with overlaps = 0

Phase 2.3 Update Timing
Phase 2.3 Update Timing | Checksum: 20c6f9dff

Time (s): cpu = 00:00:31 ; elapsed = 00:00:26 . Memory (MB): peak = 2093.609 ; gain = 129.641
INFO: [Route 35-416] Intermediate Timing Summary | WNS=0.595  | TNS=0.000  | WHS=-0.211 | THS=-104.576|


Phase 2.4 Soft Constraint Pins - Fast Budgeting
Phase 2.4 Soft Constraint Pins - Fast Budgeting | Checksum: 25029edc0

Time (s): cpu = 00:00:34 ; elapsed = 00:00:27 . Memory (MB): peak = 2120.973 ; gain = 157.004

Router Utilization Summary
  Global Vertical Routing Utilization    = 0 %
  Global Horizontal Routing Utilization  = 0 %
  Routable Net Status*
  *Does not include unroutable nets such as driverless and loadless.
  Run report_route_status for detailed report.
  Number of Failed Nets               = 13218
    (Failed Nets is the sum of unrouted and partially routed nets)
  Number of Unrouted Nets             = 13218
  Number of Partially Routed Nets     = 0
  Number of Node Overlaps             = 0

Phase 2 Router Initialization | Checksum: 1df6982e6

Time (s): cpu = 00:00:34 ; elapsed = 00:00:28 . Memory (MB): peak = 2120.973 ; gain = 157.004

Phase 3 Global Routing
Phase 3 Global Routing | Checksum: 1df6982e6

Time (s): cpu = 00:00:34 ; elapsed = 00:00:28 . Memory (MB): peak = 2120.973 ; gain = 157.004

Phase 4 Initial Routing

Phase 4.1 Initial Net Routing Pass
Phase 4.1 Initial Net Routing Pass | Checksum: 1fd769d6e

Time (s): cpu = 00:00:43 ; elapsed = 00:00:34 . Memory (MB): peak = 2155.199 ; gain = 191.230
Phase 4 Initial Routing | Checksum: 1fd769d6e

Time (s): cpu = 00:00:43 ; elapsed = 00:00:34 . Memory (MB): peak = 2155.199 ; gain = 191.230

Phase 5 Rip-up And Reroute

Phase 5.1 Global Iteration 0
 Number of Nodes with overlaps = 3153
 Number of Nodes with overlaps = 829
 Number of Nodes with overlaps = 275
 Number of Nodes with overlaps = 136
 Number of Nodes with overlaps = 48
 Number of Nodes with overlaps = 15
 Number of Nodes with overlaps = 10
 Number of Nodes with overlaps = 4
 Number of Nodes with overlaps = 6
 Number of Nodes with overlaps = 2
 Number of Nodes with overlaps = 0
INFO: [Route 35-416] Intermediate Timing Summary | WNS=0.443  | TNS=0.000  | WHS=N/A    | THS=N/A    |

Phase 5.1 Global Iteration 0 | Checksum: 2d6a85f37

Time (s): cpu = 00:01:16 ; elapsed = 00:01:01 . Memory (MB): peak = 2155.199 ; gain = 191.230
Phase 5 Rip-up And Reroute | Checksum: 2d6a85f37

Time (s): cpu = 00:01:17 ; elapsed = 00:01:01 . Memory (MB): peak = 2155.199 ; gain = 191.230

Phase 6 Delay and Skew Optimization

Phase 6.1 Delay CleanUp

Phase 6.1.1 Update Timing
Phase 6.1.1 Update Timing | Checksum: 280d30621

Time (s): cpu = 00:01:17 ; elapsed = 00:01:01 . Memory (MB): peak = 2155.199 ; gain = 191.230
INFO: [Route 35-416] Intermediate Timing Summary | WNS=0.443  | TNS=0.000  | WHS=N/A    | THS=N/A    |

Phase 6.1 Delay CleanUp | Checksum: 280d30621

Time (s): cpu = 00:01:17 ; elapsed = 00:01:01 . Memory (MB): peak = 2155.199 ; gain = 191.230

Phase 6.2 Clock Skew Optimization
Phase 6.2 Clock Skew Optimization | Checksum: 280d30621

Time (s): cpu = 00:01:17 ; elapsed = 00:01:01 . Memory (MB): peak = 2155.199 ; gain = 191.230
Phase 6 Delay and Skew Optimization | Checksum: 280d30621

Time (s): cpu = 00:01:17 ; elapsed = 00:01:01 . Memory (MB): peak = 2155.199 ; gain = 191.230

Phase 7 Post Hold Fix

Phase 7.1 Hold Fix Iter
INFO: [Route 35-416] Intermediate Timing Summary | WNS=0.443  | TNS=0.000  | WHS=0.035  | THS=0.000  |

Phase 7.1 Hold Fix Iter | Checksum: 2d10d780f

Time (s): cpu = 00:01:18 ; elapsed = 00:01:01 . Memory (MB): peak = 2155.199 ; gain = 191.230
Phase 7 Post Hold Fix | Checksum: 2d10d780f

Time (s): cpu = 00:01:18 ; elapsed = 00:01:02 . Memory (MB): peak = 2155.199 ; gain = 191.230

Phase 8 Route finalize

Router Utilization Summary
  Global Vertical Routing Utilization    = 6.29331 %
  Global Horizontal Routing Utilization  = 7.63391 %
  Routable Net Status*
  *Does not include unroutable nets such as driverless and loadless.
  Run report_route_status for detailed report.
  Number of Failed Nets               = 0
    (Failed Nets is the sum of unrouted and partially routed nets)
  Number of Unrouted Nets             = 0
  Number of Partially Routed Nets     = 0
  Number of Node Overlaps             = 0

Phase 8 Route finalize | Checksum: 2d10d780f

Time (s): cpu = 00:01:18 ; elapsed = 00:01:02 . Memory (MB): peak = 2155.199 ; gain = 191.230

Phase 9 Verifying routed nets

 Verification completed successfully
Phase 9 Verifying routed nets | Checksum: 2d10d780f

Time (s): cpu = 00:01:18 ; elapsed = 00:01:02 . Memory (MB): peak = 2155.199 ; gain = 191.230

Phase 10 Depositing Routes
Phase 10 Depositing Routes | Checksum: 2508cbcd6

Time (s): cpu = 00:01:20 ; elapsed = 00:01:03 . Memory (MB): peak = 2155.199 ; gain = 191.230

Phase 11 Post Process Routing
Phase 11 Post Process Routing | Checksum: 2508cbcd6

Time (s): cpu = 00:01:20 ; elapsed = 00:01:03 . Memory (MB): peak = 2155.199 ; gain = 191.230

Phase 12 Post Router Timing
INFO: [Route 35-57] Estimated Timing Summary | WNS=0.443  | TNS=0.000  | WHS=0.035  | THS=0.000  |

INFO: [Route 35-327] The final timing numbers are based on the router estimated timing analysis. For a complete and accurate timing signoff, please run report_timing_summary.
Phase 12 Post Router Timing | Checksum: 2508cbcd6

Time (s): cpu = 00:01:20 ; elapsed = 00:01:03 . Memory (MB): peak = 2155.199 ; gain = 191.230
Total Elapsed time in route_design: 62.724 secs

Phase 13 Post-Route Event Processing
Phase 13 Post-Route Event Processing | Checksum: 1b0bdccd9

Time (s): cpu = 00:01:20 ; elapsed = 00:01:03 . Memory (MB): peak = 2155.199 ; gain = 191.230
INFO: [Route 35-16] Router Completed Successfully
Ending Routing Task | Checksum: 1b0bdccd9

Time (s): cpu = 00:01:20 ; elapsed = 00:01:03 . Memory (MB): peak = 2155.199 ; gain = 191.230

Routing Is Done.
INFO: [Common 17-83] Releasing license: Implementation
94 Infos, 0 Warnings, 0 Critical Warnings and 0 Errors encountered.
route_design completed successfully
route_design: Time (s): cpu = 00:01:20 ; elapsed = 00:01:03 . Memory (MB): peak = 2155.199 ; gain = 191.230
INFO: [Vivado 12-24828] Executing command : report_drc -file top_drc_routed.rpt -pb top_drc_routed.pb -rpx top_drc_routed.rpx
Command: report_drc -file top_drc_routed.rpt -pb top_drc_routed.pb -rpx top_drc_routed.rpx
INFO: [IP_Flow 19-1839] IP Catalog is up to date.
INFO: [DRC 23-27] Running DRC with 2 threads
INFO: [Vivado_Tcl 2-168] The results of DRC are in file C:/Users/nguye/Desktop/artya7/artya7.runs/impl_1/top_drc_routed.rpt.
report_drc completed successfully
INFO: [Vivado 12-24828] Executing command : report_methodology -file top_methodology_drc_routed.rpt -pb top_methodology_drc_routed.pb -rpx top_methodology_drc_routed.rpx
Command: report_methodology -file top_methodology_drc_routed.rpt -pb top_methodology_drc_routed.pb -rpx top_methodology_drc_routed.rpx
INFO: [Timing 38-35] Done setting XDC timing constraints.
INFO: [DRC 23-133] Running Methodology with 2 threads
INFO: [Vivado_Tcl 2-1520] The results of Report Methodology are in file C:/Users/nguye/Desktop/artya7/artya7.runs/impl_1/top_methodology_drc_routed.rpt.
report_methodology completed successfully
report_drc: Time (s): cpu = 00:00:13 ; elapsed = 00:00:07 . Memory (MB): peak = 2162.684 ; gain = 7.484
INFO: [Vivado 12-24828] Executing command : report_timing_summary -max_paths 10 -routable_nets -report_unconstrained -file top_timing_summary_routed.rpt -pb top_timing_summary_routed.pb -rpx top_timing_summary_routed.rpx -warn_on_violation 
INFO: [Timing 38-35] Done setting XDC timing constraints.
INFO: [Timing 38-91] UpdateTimingParams: Speed grade: -1L, Delay Type: min_max.
INFO: [Timing 38-191] Multithreading enabled for timing update using a maximum of 2 CPUs
INFO: [Vivado 12-24838] Running report commands "report_incremental_reuse, report_route_status" in parallel.
Running report generation with 2 threads.
INFO: [Vivado 12-24828] Executing command : report_incremental_reuse -file top_incremental_reuse_routed.rpt
INFO: [Vivado_Tcl 4-1062] Incremental flow is disabled. No incremental reuse Info to report.
INFO: [Vivado 12-24828] Executing command : report_route_status -file top_route_status.rpt -pb top_route_status.pb
INFO: [Vivado 12-24828] Executing command : report_power -file top_power_routed.rpt -pb top_power_summary_routed.pb -rpx top_power_routed.rpx
Command: report_power -file top_power_routed.rpt -pb top_power_summary_routed.pb -rpx top_power_routed.rpx
Running Vector-less Activity Propagation...

Finished Running Vector-less Activity Propagation
111 Infos, 0 Warnings, 0 Critical Warnings and 0 Errors encountered.
report_power completed successfully
report_power: Time (s): cpu = 00:00:08 ; elapsed = 00:00:06 . Memory (MB): peak = 2187.289 ; gain = 24.605
INFO: [Vivado 12-24828] Executing command : report_clock_utilization -file top_clock_utilization_routed.rpt
INFO: [Vivado 12-24828] Executing command : report_bus_skew -warn_on_violation -file top_bus_skew_routed.rpt -pb top_bus_skew_routed.pb -rpx top_bus_skew_routed.rpx
INFO: [Timing 38-91] UpdateTimingParams: Speed grade: -1L, Delay Type: min_max.
INFO: [Timing 38-191] Multithreading enabled for timing update using a maximum of 2 CPUs
generate_parallel_reports: Time (s): cpu = 00:00:32 ; elapsed = 00:00:18 . Memory (MB): peak = 2192.625 ; gain = 37.426
INFO: [Timing 38-480] Writing timing data to binary archive.
Write ShapeDB Complete: Time (s): cpu = 00:00:00 ; elapsed = 00:00:00.048 . Memory (MB): peak = 2210.438 ; gain = 3.332
Wrote PlaceDB: Time (s): cpu = 00:00:01 ; elapsed = 00:00:01 . Memory (MB): peak = 2211.016 ; gain = 3.910
Wrote PulsedLatchDB: Time (s): cpu = 00:00:00 ; elapsed = 00:00:00 . Memory (MB): peak = 2211.016 ; gain = 0.000
Writing XDEF routing.
Writing XDEF routing logical nets.
Writing XDEF routing special nets.
Wrote RouteStorage: Time (s): cpu = 00:00:01 ; elapsed = 00:00:00.191 . Memory (MB): peak = 2211.016 ; gain = 0.000
Wrote Netlist Cache: Time (s): cpu = 00:00:00 ; elapsed = 00:00:00.027 . Memory (MB): peak = 2211.016 ; gain = 0.000
Wrote Device Cache: Time (s): cpu = 00:00:00 ; elapsed = 00:00:00.006 . Memory (MB): peak = 2211.016 ; gain = 0.000
Write Physdb Complete: Time (s): cpu = 00:00:02 ; elapsed = 00:00:01 . Memory (MB): peak = 2211.016 ; gain = 3.910
INFO: [Common 17-1381] The checkpoint 'C:/Users/nguye/Desktop/artya7/artya7.runs/impl_1/top_routed.dcp' has been generated.
Command: write_bitstream -force top.bit
Attempting to get a license for feature 'Implementation' and/or device 'xc7a35ti'
INFO: [Common 17-349] Got license for feature 'Implementation' and/or device 'xc7a35ti'
Running DRC as a precondition to command write_bitstream
INFO: [IP_Flow 19-1839] IP Catalog is up to date.
INFO: [DRC 23-27] Running DRC with 2 threads
INFO: [Vivado 12-3199] DRC finished with 0 Errors
INFO: [Vivado 12-3200] Please refer to the DRC report (report_drc) for more information.
INFO: [Designutils 20-2272] Running write_bitstream with 2 threads.
Loading data files...
Loading site data...
Loading route data...
Processing options...
Creating bitmap...
Creating bitstream...
Writing bitstream ./top.bit...
INFO: [Vivado 12-1842] Bitgen Completed Successfully.
INFO: [Project 1-1876] WebTalk data collection is mandatory when using a ULT device. To see the specific WebTalk data collected for your design, open the usage_statistics_webtalk.html or usage_statistics_webtalk.xml file in the implementation directory.
INFO: [Common 17-83] Releasing license: Implementation
126 Infos, 0 Warnings, 0 Critical Warnings and 0 Errors encountered.
write_bitstream completed successfully
write_bitstream: Time (s): cpu = 00:00:29 ; elapsed = 00:00:19 . Memory (MB): peak = 2699.703 ; gain = 488.688
INFO: [Common 17-206] Exiting Vivado at Fri Oct 31 12:51:23 2025...

*** Running vivado
    with args -log top.vdi -applog -m64 -product Vivado -messageDb vivado.pb -mode batch -source top.tcl -notrace



****** Vivado v2025.1 (64-bit)
  **** SW Build 6140274 on Thu May 22 00:12:29 MDT 2025
  **** IP Build 6138677 on Thu May 22 03:10:11 MDT 2025
  **** SharedData Build 6139179 on Tue May 20 17:58:58 MDT 2025
  **** Start of session at: Fri Oct 31 14:34:37 2025
    ** Copyright 1986-2022 Xilinx, Inc. All Rights Reserved.
    ** Copyright 2022-2025 Advanced Micro Devices, Inc. All Rights Reserved.

source top.tcl -notrace
Command: open_checkpoint top_routed.dcp
INFO: [Device 21-403] Loading part xc7a35ticsg324-1L
Netlist sorting complete. Time (s): cpu = 00:00:00 ; elapsed = 00:00:00.076 . Memory (MB): peak = 699.848 ; gain = 0.000
INFO: [Netlist 29-17] Analyzing 1051 Unisim elements for replacement
INFO: [Netlist 29-28] Unisim Transformation completed in 0 CPU seconds
INFO: [Project 1-479] Netlist was created with Vivado 2025.1
INFO: [Project 1-570] Preparing netlist for logic optimization
Read ShapeDB Complete: Time (s): cpu = 00:00:00 ; elapsed = 00:00:00.024 . Memory (MB): peak = 804.148 ; gain = 3.105
INFO: [Timing 38-478] Restoring timing data from binary archive.
INFO: [Timing 38-479] Binary timing data restore complete.
INFO: [Project 1-856] Restoring constraints from binary archive.
INFO: [Project 1-853] Binary constraint restore complete.
INFO: [Designutils 20-5722] Start Reading Physical Databases.
Reading placement.
Read Netlist Cache: Time (s): cpu = 00:00:00 ; elapsed = 00:00:00.014 . Memory (MB): peak = 1411.605 ; gain = 0.000
Reading placer database...
Read Device Cache: Time (s): cpu = 00:00:00 ; elapsed = 00:00:00.007 . Memory (MB): peak = 1411.605 ; gain = 0.000
Read PlaceDB: Time (s): cpu = 00:00:01 ; elapsed = 00:00:00.488 . Memory (MB): peak = 1411.605 ; gain = 0.000
Read PulsedLatchDB: Time (s): cpu = 00:00:00 ; elapsed = 00:00:00 . Memory (MB): peak = 1411.605 ; gain = 0.000
Reading routing.
Read RouteStorage: Time (s): cpu = 00:00:00 ; elapsed = 00:00:00.133 . Memory (MB): peak = 1419.375 ; gain = 7.770
Read Physdb Files: Time (s): cpu = 00:00:01 ; elapsed = 00:00:00.653 . Memory (MB): peak = 1419.375 ; gain = 7.770
Restored from archive | CPU: 1.000000 secs | Memory: 0.000000 MB |
Finished XDEF File Restore: Time (s): cpu = 00:00:01 ; elapsed = 00:00:00.689 . Memory (MB): peak = 1419.375 ; gain = 14.875
Netlist sorting complete. Time (s): cpu = 00:00:00 ; elapsed = 00:00:00.004 . Memory (MB): peak = 1419.375 ; gain = 0.000
INFO: [Project 1-111] Unisim Transformation Summary:
  A total of 2 instances were transformed.
  IOBUF => IOBUF (IBUF, OBUFT): 2 instances

INFO: [Project 1-604] Checkpoint was created with Vivado v2025.1 (64-bit) build 6140274
open_checkpoint: Time (s): cpu = 00:00:16 ; elapsed = 00:00:14 . Memory (MB): peak = 1424.066 ; gain = 1144.703
Command: write_bitstream -force top.bit -bin_file
Attempting to get a license for feature 'Implementation' and/or device 'xc7a35ti'
INFO: [Common 17-349] Got license for feature 'Implementation' and/or device 'xc7a35ti'
Running DRC as a precondition to command write_bitstream
INFO: [IP_Flow 19-234] Refreshing IP repositories
INFO: [IP_Flow 19-1704] No user IP repositories specified
INFO: [IP_Flow 19-2313] Loaded Vivado IP repository 'C:/Xilinx2025/2025.1/Vivado/data/ip'.
INFO: [DRC 23-27] Running DRC with 2 threads
INFO: [Vivado 12-3199] DRC finished with 0 Errors
INFO: [Vivado 12-3200] Please refer to the DRC report (report_drc) for more information.
INFO: [Designutils 20-2272] Running write_bitstream with 2 threads.
Loading data files...
Loading site data...
Loading route data...
Processing options...
Creating bitmap...
Creating bitstream...
Writing bitstream ./top.bit...
Writing bitstream ./top.bin...
INFO: [Vivado 12-1842] Bitgen Completed Successfully.
INFO: [Project 1-1876] WebTalk data collection is mandatory when using a ULT device. To see the specific WebTalk data collected for your design, open the usage_statistics_webtalk.html or usage_statistics_webtalk.xml file in the implementation directory.
INFO: [Common 17-83] Releasing license: Implementation
23 Infos, 0 Warnings, 0 Critical Warnings and 0 Errors encountered.
write_bitstream completed successfully
write_bitstream: Time (s): cpu = 00:00:19 ; elapsed = 00:00:13 . Memory (MB): peak = 2005.348 ; gain = 581.281
INFO: [Common 17-206] Exiting Vivado at Fri Oct 31 14:35:06 2025...
